{
  "schema": "ticket-result/1",
  "run_id": "runtime-reset",
  "ticket_id": "inspector-closeout",
  "role": "inspector",
  "status": "done",
  "summary": "The rewritten protocol is coherent and the legacy wire contract is gone.",
  "verdict": "pass",
  "findings": [
    "Only ticket-dispatch/1 and ticket-result/1 remain in the installable skill."
  ]
}
